Title,Link,Unique_ID
Cheapest good laptop to run steamvr fore bonelab fusion helper,https://www.reddit.com/r/Laptop/comments/1pjn3bd/cheapest_good_laptop_to_run_steamvr_fore_bonelab/,bce4b01a59c5
Help: My laptop is not turning on.,https://www.reddit.com/r/Laptop/comments/1pji8t8/help_my_laptop_is_not_turning_on/,df919dc6951c
$1000 Student Laptop,https://www.reddit.com/r/Laptop/comments/1pjeqmu/1000_student_laptop/,ddb4dad07048
Engineering student laptop,https://www.reddit.com/r/Laptop/comments/1pj6w6q/engineering_student_laptop/,4652c3226c6c
Should I buy laptop or tablet? Budget strictly 16k,https://www.reddit.com/r/Laptop/comments/1pik1ln/should_i_buy_laptop_or_tablet_budget_strictly_16k/,452f8adbf5bc
What should I do first with my new laptop?,https://www.reddit.com/r/Laptop/comments/1pioi88/what_should_i_do_first_with_my_new_laptop/,b51763ac71b9
What laptop should i buy?,https://www.reddit.com/r/Laptop/comments/1phx1jw/what_laptop_should_i_buy/,b3daefefdf37
Most reliable laptop for software dev + music production?,https://www.reddit.com/r/Laptop/comments/1phpd5o/most_reliable_laptop_for_software_dev_music/,12baef095092
Ruined my brand new laptop,https://www.reddit.com/r/Laptop/comments/1ph5ffe/ruined_my_brand_new_laptop/,8f19827e9064
Laptop advice,https://www.reddit.com/r/Laptop/comments/1phbc3f/laptop_advice/,b751cee78248
What are you guys buying a laptop for?,https://www.reddit.com/r/Laptop/comments/1pgwxfk/what_are_you_guys_buying_a_laptop_for/,54ec630836a3
"Need help choosing an affordable, leather-free headset/microphone?",https://www.reddit.com/r/buildapc/comments/1pjvvx6/need_help_choosing_an_affordable_leatherfree/,a546481854e9
My laptop crashed,https://www.reddit.com/r/techsupport/comments/1pjy7fh/my_laptop_crashed/,2decfdf42887
Battery damage while trying to replace?,https://www.reddit.com/r/techsupport/comments/1pjzk79/battery_damage_while_trying_to_replace/,0b8ee9f55938
"Help me identify an ideal laptop for a retiring professional educator, <=$1000 USD",https://www.reddit.com/r/Laptop/comments/1pk1key/help_me_identify_an_ideal_laptop_for_a_retiring/,e0567f98fee7
recovering lost photos/videos,https://www.reddit.com/r/techsupport/comments/1pkam5b/recovering_lost_photosvideos/,176a4e0decdb
How much does a pc cost?,https://www.reddit.com/r/buildapc/comments/1pkb5es/how_much_does_a_pc_cost/,da04d03f0ee6
"Is $800 a good price for this PC, or could I reasonably build it for cheaper?",https://www.reddit.com/r/buildapc/comments/1pkfi0j/is_800_a_good_price_for_this_pc_or_could_i/,022aa6ad8b46
Help estimating resell price of prebuilt,https://www.reddit.com/r/buildapc/comments/1pkjo4p/help_estimating_resell_price_of_prebuilt/,e9d669d1eec3
How do I find a way to refund my Chuwi Corebook X 3i,https://www.reddit.com/r/Laptop/comments/1pkkfb1/how_do_i_find_a_way_to_refund_my_chuwi_corebook_x/,fd49c786f2e9
"Laptop keeps double booting, any solutions?",https://www.reddit.com/r/techsupport/comments/1pkkyzq/laptop_keeps_double_booting_any_solutions/,c09dacc9be58
Please Help Me Find a Laptop,https://www.reddit.com/r/SuggestALaptop/comments/1pk99sq/please_help_me_find_a_laptop/,ed9e52f38a31
Help me choose a laptop,https://www.reddit.com/r/SuggestALaptop/comments/1pke3qt/help_me_choose_a_laptop/,09bfc4fa0f77
Budget laptop in Europe (unless UK is cheaper?),https://www.reddit.com/r/SuggestALaptop/comments/1pk6pgj/budget_laptop_in_europe_unless_uk_is_cheaper/,560b289516c8
Need a laptop with good battery life at or under $500-$600.,https://www.reddit.com/r/SuggestALaptop/comments/1pkb64z/need_a_laptop_with_good_battery_life_at_or_under/,9671efeb1157
NZ $800-$1500,https://www.reddit.com/r/SuggestALaptop/comments/1pkay34/nz_8001500/,10b6d8a5d0ee
"Need Laptop suggest for tech school, France ~1000€",https://www.reddit.com/r/SuggestALaptop/comments/1pk84i6/need_laptop_suggest_for_tech_school_france_1000/,8772e22727d0
idiot needs help finding gaming laptop under $1000,https://www.reddit.com/r/SuggestALaptop/comments/1pk12au/idiot_needs_help_finding_gaming_laptop_under_1000/,33474759843c
Budget laptop in Europe (unless UK is cheaper?),https://www.reddit.com/r/SuggestALaptop/comments/1pk6pam/budget_laptop_in_europe_unless_uk_is_cheaper/,674e24c249c4
have a budget of around $200 USA,https://www.reddit.com/r/SuggestALaptop/comments/1pk6drc/have_a_budget_of_around_200_usa/,3e8ebb833a06
"Laptop Purchase USA, <=$1,000 USD, performance-focus",https://www.reddit.com/r/SuggestALaptop/comments/1pk3mnt/laptop_purchase_usa_1000_usd_performancefocus/,4fa174ce0cb4
"I need a small, budget laptop for traveling.",https://www.reddit.com/r/SuggestALaptop/comments/1pk3ak8/i_need_a_small_budget_laptop_for_traveling/,919327dc81a6
"Retiring Education Professional Seeking Replacement Laptop, Performance Focus, <=$1000 USD",https://www.reddit.com/r/SuggestALaptop/comments/1pk1fj7/retiring_education_professional_seeking/,a1b0c1076d29
"Retiring education professional seeking laptop for home/light work use, performance focus, $1000 =< USD",https://www.reddit.com/r/SuggestALaptop/comments/1pk1dqu/retiring_education_professional_seeking_laptop/,6b5472e95dc8
"Laptop suggestion for retiring education professional, $1000 or less, New, Performance focus",https://www.reddit.com/r/SuggestALaptop/comments/1pk1c2g/laptop_suggestion_for_retiring_education/,9a6fc51bd2ab
Need your help! Best Laptop to Buy?,https://www.reddit.com/r/SuggestALaptop/comments/1pk0uzs/need_your_help_best_laptop_to_buy/,c7f8982b43d6
In Search of a Shared Home Laptop,https://www.reddit.com/r/SuggestALaptop/comments/1pjyntq/in_search_of_a_shared_home_laptop/,ceb2f597c5dc
"✨💻 ❄️ [December's Buyers Guide] ----> Deals on General Use Laptops, Budget Gaming Laptops, Video Editing, Professional Use & Student Laptops In The List Below. ❄️✨💻",https://www.reddit.com/r/LaptopDeals/comments/1pjt9yq/decembers_buyers_guide_deals_on_general_use/,77fe59d915b8
"[eBay, Price Drop] Gigabyte Aero X16 Gaming Laptop (2025): 16"" (2560×1600) 165Hz WQXGA Display, Ryzen AI 7 350, NVIDIA GeForce RTX 5070, 32GB RAM, 1TB SSD, Now: $1,199.99 After using code: ""KLARNAUS50"" for $50 off with payment via KLARNA #ad",https://www.reddit.com/r/LaptopDeals/comments/1pkh3yy/ebay_price_drop_gigabyte_aero_x16_gaming_laptop/,85f17379ea0c
"[eBay] Acer Predator Helios Neo 16S AI Gaming Laptop (Cert. Refurbished): 16"" (2560x1600) 240Hz 16:10 500-nits OLED Display, Intel Ultra 9 275HX, RTX 5060, 16GB DDR5, 1TB SSD. Now: $880.11 After using code: ""KLARNAUS50"" for $50 off with payment via KLARNA #ad",https://www.reddit.com/r/LaptopDeals/comments/1pkhbrv/ebay_acer_predator_helios_neo_16s_ai_gaming/,36a05744cf6d
"[Walmart] ASUS Vivobook Laptop: 16"" WUXGA (1920 x 1200) Display, Intel Core i7-1355U, Integrated Intel Iris Xe Graphics, 16GB RAM, 512GB SSD Black. Now: $496.98 After $153.01 Off",https://www.reddit.com/r/LaptopDeals/comments/1pkd3lg/walmart_asus_vivobook_laptop_16_wuxga_1920_x_1200/,1ca9cf63b65c
"[Amazon] GIGABYTE A16 PRO Gaming Laptop: 16"" QHD+ 165Hz IPS Display, NVIDIA GeForce RTX 5070 Ti, Intel Core 7 240H, 32GB RAM, 1TB SSD. Now: $1,679.99 After 20% Off",https://www.reddit.com/r/LaptopDeals/comments/1pkd9s8/amazon_gigabyte_a16_pro_gaming_laptop_16_qhd/,9c6e03014936
"[Walmart] ASUS VivoBook 16 Laptop: 16"" WUXGA FHD+ IPS Display, Intel i7-13620H, 16GB RAM, 512GB SSD, Now: $449.99 After $50 Off",https://www.reddit.com/r/LaptopDeals/comments/1pkd1a4/walmart_asus_vivobook_16_laptop_16_wuxga_fhd_ips/,68920e76c9fd
"[eBay, PRICE DROP] Acer Predator Helios Neo 16S AI Gaming Laptop: 16"" (2560 x 1600) OLED 240Hz Display, Intel Core Ultra 9 Series 2, NVIDIA GeForce RTX 5070Ti, 32GB RAM, 1TB SSD. Now: $1,499.99 After 21% Off #ad",https://www.reddit.com/r/LaptopDeals/comments/1pjxtvf/ebay_price_drop_acer_predator_helios_neo_16s_ai/,f9a49138945c
"[Walmart] ASUS Vivobook S 14: 14"" FHD+ OLED, Intel Ultra 7 258V, Arc 140V, 32GB LPDDR5, 1TB SSD with $100 off, for $799",https://www.reddit.com/r/LaptopDeals/comments/1pk9egr/walmart_asus_vivobook_s_14_14_fhd_oled_intel/,44f326970767
"[Walmart, PRICE DROP] Acer Nitro V 16S Gaming Laptop: 16” WUXGA IPS 180Hz Display, Intel Core 7 240H, NVIDIA GeForce RTX 5060, 16GB DDR5 RAM, 1TB SSD. Now: $799 After $400 Off",https://www.reddit.com/r/LaptopDeals/comments/1pjxs9j/walmart_price_drop_acer_nitro_v_16s_gaming_laptop/,db3e5097488e
"[Walmart, PRICE DROP] Acer Nitro V AI Gaming Laptop: 16 WUXGA (1920 x 1200) IPS 180Hz Display, AMD Ryzen 5 240, NVIDIA RTX 5050, 16GB DDR5 RAM, 512GB SSD, Win11 Home - Now: $599 After $300 Off",https://www.reddit.com/r/LaptopDeals/comments/1pjxsvf/walmart_price_drop_acer_nitro_v_ai_gaming_laptop/,ffdb9c1b9d54
"[eBay] Cert. Refurbished Acer Swift Go Laptop: 16"" (1920x1200) 350-nits IPS Touchscreen Display, Intel Ultra 9, Intel Arc Graphics (8 X Cores), 32GB RAM, 1TB SSD + (2 yr warranty), Now: $572.44 After 43% Off #ad",https://www.reddit.com/r/LaptopDeals/comments/1pjlshg/ebay_cert_refurbished_acer_swift_go_laptop_16/,c2916fb2ed3e
"[Amazon] ASUS Vivobook S 14 Thin & Lightweight Laptop: 14"" 3K (2880 x 1800) OLED 120Hz, Ryzen AI 9 365, AMD 880M Graphics, 24GB LPDDR5X, 1TB SSD - for $999.99 after 20% off",https://www.reddit.com/r/LaptopDeals/comments/1pjic3t/amazon_asus_vivobook_s_14_thin_lightweight_laptop/,f27f0e506708
"[Walmart] HP OmniBook 5 Laptop: 16"" FHD IPS 2k Display, Ryzen AI 7 350, AMD Radeon™ 860M Graphics, 16GB RAM, 512GB SSD, Now: $499 After $440 Off",https://www.reddit.com/r/LaptopDeals/comments/1pj4sgv/walmart_hp_omnibook_5_laptop_16_fhd_ips_2k/,b2d21ab6a50b
"[Walmart] HP Victus Gaming Laptop: 15.6"" FHD IPS 144Hz Display, Intel i5-13420H, NVIDIA GeForce RTX 4050, 16GB DDR5 RAM, 512GB SSD. Now: $579 After $470.99 Off",https://www.reddit.com/r/LaptopDeals/comments/1pj4vlv/walmart_hp_victus_gaming_laptop_156_fhd_ips_144hz/,7262f59c3561
"[eBay] Acer Swift Go 16 Laptop (Cert. Refurbished): 16"" (2880×1800) 3K 120Hz OLED Display, Intel Ultra 9 285H, Intel Arc Graphics, 32GB RAM, 1TB SSD, Now: $768.19 After 40% Off + a 2-year warranty serviced by Allstate #ad",https://www.reddit.com/r/LaptopDeals/comments/1piveih/ebay_acer_swift_go_16_laptop_cert_refurbished_16/,d6c04a8b1f3d
"[Walmart] MSI Katana 15 HX Gaming Laptop: 15.6"" QHD 165Hz IPS Display, Intel Core i7-14650HX, RTX 5070, 16GB DDR5 RAM, 1TB Gen4 SSD, Win11H. Now: $1,099 After $400.99 Off",https://www.reddit.com/r/LaptopDeals/comments/1pimk2z/walmart_msi_katana_15_hx_gaming_laptop_156_qhd/,43c9a1115030
"[Walmart] ASUS VivoBook Laptop: 15.6” FHD IPS Display, Intel Core 5 120U, Intel® Graphics, 16GB RAM, 512GB SSD. Now: $399 After $100 Off",https://www.reddit.com/r/LaptopDeals/comments/1pimje2/walmart_asus_vivobook_laptop_156_fhd_ips_display/,d2cbb8002341
"[eBay] Cert. Refurbished ASUS VivoBook S16 Laptop: 16.0"" OLED 3.2K (3200x2000) 120Hz Display, Ryzen AI 9 365, AMD Radeon 880M Integrated Graphics, 32GB RAM, 1TB SSD, Now: $879 After 32% Off #ad",https://www.reddit.com/r/LaptopDeals/comments/1pi96b3/ebay_cert_refurbished_asus_vivobook_s16_laptop/,16571757b3e9
"[eBay] Lenovo LOQ Gaming Laptop: 15.6"" IPS LCD FHD 144Hz Display, 16GB RAM 512GB SSD, AMD Ryzen 7 250, NVIDIA GeForce RTX 5060, Luna Grey. Now: $919.99 After 20% Off #ad",https://www.reddit.com/r/LaptopDeals/comments/1pi976a/ebay_lenovo_loq_gaming_laptop_156_ips_lcd_fhd/,d68bc1923b94
"[Amazon] Dell 15 Laptop -15.6-inch FHD 120Hz Display, Intel Core 3 Processor 100U Processor, 8GBRAM, 512GB SSD, Intel UHD Graphics, Windows 11 Home, Onsite Service - Carbon Black. Now: $339 After 15% Off",https://www.reddit.com/r/LaptopDeals/comments/1pi9g8q/amazon_dell_15_laptop_156inch_fhd_120hz_display/,958be455cda1
"[Lenovo] Lenovo Legion Pro 5i Gaming Laptop (2025): 16"" (2560 x 1600) 165Hz OLED Display, Intel Core Ultra 9 275HX, NVIDIA RTX 5070 Ti, 32GB DDR5 RAM, 1TB SSD. Now: $1,733.74 After 30% + Using coupon code: ""EXTRAFIVE""",https://www.reddit.com/r/LaptopDeals/comments/1phvrgt/lenovo_lenovo_legion_pro_5i_gaming_laptop_2025_16/,9ac0260eb8b9
Should I buy a new laptop now to save money?,https://www.reddit.com/r/laptops/comments/1pkn6oq/should_i_buy_a_new_laptop_now_to_save_money/,5561111f6807
Laptop suggestions for teachers $400 USD,https://www.reddit.com/r/laptops/comments/1pkn068/laptop_suggestions_for_teachers_400_usd/,f108c6b7d7c6
Looking for a laptop up to 500 Euro. Used or new.,https://www.reddit.com/r/laptops/comments/1pkblhu/looking_for_a_laptop_up_to_500_euro_used_or_new/,89fadfaadf9b
Decent Linux-compatible laptops,https://www.reddit.com/r/laptops/comments/1pkmcou/decent_linuxcompatible_laptops/,6ea1946a63a5
Searching for cheap Hewlett Packard laptop keyboard replacement,https://www.reddit.com/r/laptops/comments/1pkm4z3/searching_for_cheap_hewlett_packard_laptop/,5c222cff9671
Please recommend me any good laptops on sale/where to buy in bangkok(specs below),https://www.reddit.com/r/laptops/comments/1pklikz/please_recommend_me_any_good_laptops_on_salewhere/,368e59fcf832
"Bought two Acer laptops for Black Friday, wondering which one to keep",https://www.reddit.com/r/laptops/comments/1pkkyny/bought_two_acer_laptops_for_black_friday/,5cad98571f43
Having trouble picking a Laptop,https://www.reddit.com/r/laptops/comments/1pkkkr2/having_trouble_picking_a_laptop/,d1215e5873b3
